run_id,date,participant_persona,stage,package_version,case_id,dataset_source,command,runtime_sec,outputs_created,pass_fail,main_difficulty,concept_confusion,feature_request,follow_up_issue_id
RUN-001,2026-07-08,Team FlowState (traffic MS students),Stage 0 install + smoke,2.2.0,toy,simulated corridor,api.verify_installation(),30,console PASS,PASS,scare-print about missing detector file,planted class spillback_source vs active_bottleneck,reword install-time detector message,T-7
RUN-002,2026-07-08,Team FlowState,Stage 3 calibration,2.2.0,I-405S,ieee_v4_samples,api.diagnose(df_I405S),6.8,620 episodes; 13 ranked sensor-periods,PASS,hand-written 35-line adapter; southbound milepost reversal,per-lane vs total flow,ship load_ieee_v4,T-1;T-4;T-5
RUN-003,2026-07-08,Team FlowState,Stage 2 benchmark cross-check,2.2.0,I-5N,ieee_v4_samples,api.fit_fd_huber per detector,<60,"capacity ratios fit/shipped 0.82-0.87 (congested), 1.21 (uncongested)",PASS,fd_summary None: undocumented density_vpm,identifiability of capacity on uncongested detectors,identifiability flag on FD fits,T-2;T-3;T-9
RUN-004,2026-07-08,Team GradientDescent (solo ML),Stage 0 quickstart,2.2.0,toy,README verbatim,simulate_corridor -> diagnose,5,ranking frame,PASS,none (ran first try),,,
RUN-005,2026-07-08,Team GradientDescent,Stage 3 feature extraction,2.2.0,I-405N,ieee_v4_samples,api.diagnose(df_I405N),2.6,634 episodes; 27 ranked; QC 90.8%,PASS,3 crash-retry cycles to find real contract,bin indices vs clock time,t0/t2/t3_time columns; schema table,M-5;M-8
RUN-006,2026-07-08,Team GradientDescent,Units-poisoning test,2.2.0,I-405N,ieee_v4_samples (km/h as mph),api.diagnose(unconverted),2.6,plausible but WRONG ranking; QC pass 0.079,FAIL,zero warnings on silent garbage,km/h vs mph,loud units guard + speed_units param,M-1
RUN-007,2026-07-08,review panel x5 (MIT/UCB/ASU/CS/Delft),Docs+website read-through,2.2.0,docs,repo,persona review (read-only),-,49 findings,-,see SIMULATED_PANEL report,demand proxy; seed-dependent ranking; provenance,LICENSE/CITATION; simulator physics rewrite,SIM-P*;SIM-NB1;SIM-B1
